{"$schema":"https://json-schema.org/draft/2020-12/schema","type":"object","required":["review_id","case_id","binding_id","metadata_field","reviewer_id","decision","timestamp_utc","evidence_snapshot_sha256","golden_set_version","catalog_contract_version","catalog_contract_sha256"],"properties":{"review_id":{"type":"string","minLength":1},"case_id":{"type":"string","minLength":1},"binding_id":{"type":"string","minLength":1},"metadata_field":{"type":"string","minLength":1},"reviewer_id":{"type":"string","minLength":1},"decision":{"enum":["ACCEPT_AS_IS","ACCEPT_WITH_MINOR_EDIT","RESEARCH_REQUIRED","REJECT"]},"timestamp_utc":{"type":"string","format":"date-time"},"comment":{"type":"string"},"error_codes":{"type":"array","uniqueItems":true,"items":{"enum":["UNSUPPORTED_VALUE","WRONG_BINDING","WRONG_INTENT","GROUNDING_ERROR","CARDINALITY_ERROR","NORMALIZATION_ERROR","CONTROLLED_VOCABULARY_ERROR","MISSED_EXPECTED_CANDIDATE","FALSE_PROPOSAL_WHEN_ABSTENTION_EXPECTED"]}},"proposed_corrected_value":{"type":["string","null"]},"final_abstention_recommended":{"type":"boolean"},"source_refs":{"type":"array","items":{"type":"string"}},"evidence_snapshot_sha256":{"type":"string","pattern":"^[A-Fa-f0-9]{64}$|^REPLACE_[A-Z0-9_]+$"},"golden_set_version":{"type":"string","minLength":1},"catalog_contract_version":{"type":"string","minLength":1},"catalog_contract_sha256":{"type":"string","pattern":"^[A-Fa-f0-9]{64}$|^REPLACE_[A-Z0-9_]+$"}},"additionalProperties":false}
