{"review_id":"REPLACE_REVIEW_ID","case_id":"REPLACE_CASE_ID","binding_id":"REPLACE_BINDING_ID","metadata_field":"REPLACE_METADATA_FIELD","reviewer_id":"REPLACE_REVIEWER_ID","decision":"RESEARCH_REQUIRED","timestamp_utc":"2026-01-01T00:00:00Z","comment":"Template only; replace with an independent cataloger judgment.","error_codes":[],"proposed_corrected_value":null,"final_abstention_recommended":false,"source_refs":[],"evidence_snapshot_sha256":"REPLACE_EVIDENCE_SHA256","golden_set_version":"REPLACE_GOLDEN_SET_VERSION","catalog_contract_version":"REPLACE_CATALOG_CONTRACT_VERSION","catalog_contract_sha256":"REPLACE_CATALOG_CONTRACT_SHA256"}
